,date,review,rating,isEdited,title,userName,developerResponse
2166,2016-02-05 09:31:20,"this app is very good!but could be really fantastic but for the stupidly annoying photo's that you KEEP adding!!some MANY of which are WHOLLY INNAPROPRIATE for CHILDREN to look at !! 
please STOP that happenning!!!then you can have 5 STARS !!!!!",4,False,very good,grumpy .,
2167,2015-08-25 11:46:25,Please allow to empty entire recycle bin more easily easily instead of having to select each file individually.,4,False,"Hey, look at me! Add this feature",BigBobbyLoveJoy,
2168,2015-02-12 22:13:02,This app now crashed so often I give up on it .,5,False,What has happened,One doc user,
2169,2016-12-18 18:44:17,Good way to store info in the cloud and share amongst friends,5,False,One drive app,Steelerowl,
2170,2014-12-26 14:18:43,"Used to be good but now it's impossible to log in to the app if you have 2FA enabled. You can enter account details without a problem but when you switch to your authenticator app to complete the login, the account details you just entered get wiped and you have to start again. Ludicrously stupid oversight.",1,False,Flawed,Lensfinity,
2171,2013-04-04 04:56:44,"Guys, try to remove old version and install this one instead updating. It works fine for me",4,False,"Works fire, but laggy",Mogolent,
2172,2012-07-30 23:42:54,Downloaded app and it worked fine then got a new email in my msn inbox so went onto the app to load up my pics and it hasn't recognised a new folder of images. Sometimish. If it worked and was efficient would be a good app,2,False,Load of junk,Crissy791,
2173,2012-06-07 14:27:45,"Works perfect! You can view share, download or upload photos and documents from your SkyDrive with ease. The best app for cloud storage so far.",4,False,Excellent app! (v2.1),nobbdy,
2174,2012-04-26 15:44:57,"Yes, i can finally view word docs in their correct format but...

No editing on the iPad, no offline functionality... What is the point?

Also, cannot edit docs with comments or track changes when using it on a PC...",2,False,Disappointing!,CowgirlPodcaster,
2175,2016-09-04 07:41:23,"Absolutely love this app, shame they lowered the free space by so much so have filled mine and got another free app to use but still love this one",5,False,Love it,Roxyallgood,
2176,2016-04-26 11:51:05,"At last, I can now save photo's straight from my picture folders. Seems to work pretty fast too. Love it!!!",4,False,Share extension,Steve rish,
2177,2016-07-27 12:03:24,After being forced to buy more storage because of the extreme reduction in storage space. I find it won't auto update iPhone  photos and constantly crashes. Going to give it a week if not then Dropbox will be the way to go,1,False,Crashes constantly,Jimmy1973,
2178,2016-01-02 10:12:55,"Very useful, take pics on my phone and they're automatically uploaded to this app on my iPad , makes life easier, works well",4,False,Good app,Mebhgdfhjy543,
2179,2016-01-05 07:06:30,"Disappointed that the update still doesn't offer the ability to select folders for offline viewing, just individual files....",2,False,Disappointing...,nepholits,
2180,2015-12-08 07:54:52,Not sure why anyone would dislike this app or service the amount of free space you get is amazing!! Love it!!,5,False,Love Onedrive!!!,Caplinski,
2181,2015-08-12 08:22:17,"Simply put, ""One Drive is awesome!"" There's not much more to say except it ticks all the boxes for me. I'd rate it more than 5!stars if I could.",5,False,One Drive is awesome.,mr_chumbles,
2182,2015-04-18 14:37:42,"Love OneDrive, love the unlimited storage. The service is becoming better and better with every update.

The latest update provides, Apple watch features and a new PDF viewing experience. 

Things I would appreciate in the next one drive update,

1- PDF cover art viewing 
2- ePub cover art and reading experience",5,False,Great,Apple...User,
2183,2015-08-04 04:54:06,"My deleted pictures get up loaded to, and if I edit something and change its colour tone it doesn't up load it to how I have made it.  
This is annoying as I can spend ages deleting and working on my photos, and I have to redo it in this app afterwards as well. Any advice how to stop this is welcome.",1,False,Editing,Hfgdtvcvfh,
2184,2015-07-08 22:30:03,Works well for the most part. Since update won't allow me to share files or folders. Keeps saying sharing is blocked. Verify account.,3,False,Could be so good,ianac,
2185,2013-11-24 21:38:10,Brilliant app and now with photo backup service it just gona even better. Love the app and it does what I want it to do. Brillant,5,False,Well Done,ShaksBoss,
2186,2014-07-31 19:33:42,Compares with other products the sync with One Drive is so incredibly slow. Dropbox is at least 10 times faster on the same network. Useful space but MS need to fix this sync issue,2,False,Sync is so incredibly slow,NWSmart,
2187,2013-01-03 19:02:21,Did exactly what it promised. Extra storage is exceptional value for money.,5,False,Credit where it's due...,88PK,
2188,2012-10-28 16:20:39,Tgis works great with my surface and windows 8 computer!   You also get more memory than drop box,5,False,"Great, works with windows RT",Dazrey,
2189,2017-03-25 11:44:53,Good additions but desperately needs iOS Live Photo support which is offered by it's main competitor!,5,False,Live Photo,JAgar86,
2190,2012-02-28 19:23:36,"I have it on my phone and I really like it
but I stopped using it because it didn't have a multiple upload feature!!",3,False,NEEDS MULTIPLE UPLOAD!!!,Fozzie ,
2191,2011-12-14 00:02:49,"Good work Microsoft 3 small problems. 1 needs to work on iPad 
2 you need to be able to multiple delete and select photos. 
3 the big one for me is ... IT COMPRESSES THE VIDEOS!!!! 

Please don't compress I want the full quality videos to share not a compressed low quality version. 

Good start though gland your trying to do catch up :-)",4,False,Good start,Mattygreen0,
2192,2017-09-07 21:27:55,The only small issue is that with today's tech you really need more free space. But there is always Dropbox and google drive,4,False,OneDrive is fab,The trusted1,
2193,2017-03-12 07:56:44,I use this everyday and it never fails.,5,False,Works Perfectly,Pete Bamford,
2194,2017-03-07 14:03:34,"I use this a lot for work and it's a slick, reliable app. Can't fault it and love the integration with the share menu.",5,False,Great app,bnawaz168,
2195,2016-06-08 17:03:18,Love this app. Can't fault it. Auto upload is a great feature. Nothing else to say.,5,False,Does what it's says,Jismisgoo,
2196,2016-09-24 10:48:30,"As I sometimes have to send files at short notice, this app is spot on. I can review, and with the word app, quickly edit files on the go and don't miss deadlines.",3,False,"Great, fast access",Steve.m.e,
2197,2015-11-06 07:11:47,Does what it says. Save in one place get in on all devices very handy and quick,5,False,Brilliant app,jaycloth1,
2198,2016-05-22 20:03:00,"The upload speed of photos and videos from this app is so slow, to the point it can be measured in months, not days.  I came back from a trip to Disneyland on 25th March and OneDrive is still uploading my photos!  (It's May 17th)  It would be quicker just to fly back.",1,False,Embarrassingly slow,Doubletrees87,
2199,2015-09-16 23:30:28,Great app much better than anything else I've tried,5,False,One drive,dscxc,
2200,2015-05-12 15:46:17,"Onedrive integrates with iOS better than Google Drive, particularly in the photo sharing space.",5,False,Top notch,dlabrosse,
2201,2015-05-26 20:30:10,"As per a couple of other reviews, since the most recent update, it now only shows across about 3/4 of the screen on an iPad. Even a full reset doesn't resolve. This is on iPad Air 2 with IOS 8.3",3,False,Onedrive,Drew350,
2202,2013-11-23 11:58:37,"Camera roll backup takes this from a 4 to a 5 star app! 

You can save gbs of data now and still keep photos and vids on my phone. Seamless integration. 

App always been useful for backing up key files for use when away or ref. 

Well done Microsoft definitely not a fail on this one!!",5,False,Essential,towersofbass,
2203,2015-01-21 22:53:57,"I use this app as it used to backup my photos to OneDrive!!! I open it, it says there are photos to upload....... Then nothing.. Nothing works.... It's crap, it won't show me photos that I have backed up, it won't show me what it thinks needs backing up. 
Don't bother until the whole thing is fixed....",1,False,Bloody awful,Pologuy2,
2204,2014-09-21 05:36:55,"Since ios8 have been having random uploads , does not upload pics that I have selected just uploads what it wants, for example I selected 19 photos of my kids to upload , the one drive uploaded 9 photos of my new bathroom install at random .... Brill",2,False,Random uploads,Mudyf0x,
2205,2014-03-25 10:20:34,"Great app in general but without a search facility I can't use it on a day by day basis. My OneDrive has 10,000+ files and thus I need to be able to at least search filenames!",3,False,Where is the search facility,dz006,
2206,2014-02-05 21:38:12,"I have hundreds of work documents which I need to access.....without the option to search it's bl@@dy hopeless!.....
I'm having to use Dropbox as a go between to use the search function....
This is just no good..... It's no wonder I'm thinking of buying an iMac and getting rid of my PC....for good!",1,False,Poor programming and NO search!,Spotty orange,
2207,2016-12-04 20:54:55,"Really easy to use and never any problems syncing across platforms, lots of free storage, brilliant",5,False,Lots of free storage,Gino5623,
2208,2013-05-11 19:27:27,"Brilliant app, but doesn't support Microsoft Authenticator and Two Step Authentication if enabled on your Microsoft Account. Means you can't log-in at all.",4,False,Doesn't yet support Two Factor Authentication,MurphS2010,
2209,2013-04-03 21:01:01,Hard to believe this is all Microsoft can come up with. You can't edit. Almost useless. And if you use skydrive be careful because there is not even autosave and every few minutes you lose every change because of server issues. Dire. Use another app like Evernote.,1,False,Pitiful,AlainnDiagha,
2210,2012-05-18 18:45:27,"Wonderful and useful app, unfortunately this app is getting crashed on my iPad 1. Hope Apple fix this issue.",4,False,skydrive crashing,Vijay Paliath,
2211,2016-08-22 22:18:40,Enables me to have so much info at hand on my phone and to share with others. Essential Busines tool for me.,5,False,Brilliant,Duffmiester,
2212,2016-07-18 07:35:54,"Nicely made app, brings my pc and phone together with no stress",5,False,"It works fine, get it",Dickieboyyyy,
2213,2015-12-16 15:49:46,After latest update app doesn't work.,5,False,Update,Artfrom,
2214,2016-05-08 08:40:57,"Since the latest update was downloaded onto my 5s, I haven't been able to open one drive! Before the update it was amazing; it worked perfectly. I hope they do something to stop this and if/when they do, I'll change my review.",1,False,Awful update!,Tudstir,
2215,2016-03-11 10:39:45,Please add a feature to save the annotations so that it can be accessed on the other devices with the same account!,4,False,Would give 5 ⭐️ if...,Rabz97,
2216,2015-03-16 12:59:49,They have done a great job fixing the app and it's working again!!,5,False,It's working again!!!!,12345subster1,
2217,2015-10-06 21:45:37,"Photos are slow and buggy to load, it takes up to ten attempts to get a 30 second video to even play, when it finally does it buffers and stops and starts. Attempting to download the video also fails. Pathetic cloud service, not even worth the free 1TB I received.",1,False,0 Stars,Jayjayemily_,
2218,2015-07-23 16:29:26,Only thing which giving disappointment is photo upload is paused if you are out from app.,4,False,Good one.,DCNSakthi DCNS [VU3TNS],
2219,2015-06-26 07:45:45,Is sufficient for purpose. Pictures from camera roll are synchronised with cloud and afterwards you can attach it to emails.,4,False,Working well,apogeum,
2220,2016-11-19 21:20:20,After using & trying many different 'cloud' storage systems OneDrive offers me the simplest & easiest solution,5,False,Great App,JCAW66,
2221,2015-03-14 08:02:32,Nice. Microsoft created one app to connect personal and business accounts. I linked a business account with new version of this app and it always crashes after few seconds of use.,2,False,App always crashes,Tom Knapik,
2222,2015-02-15 11:08:43,"Was a fantastic app until recent ""upgrade"". Now it won't load files/pictures/etc and as for uploading.....forget it",3,False,What happened?!,CelynBon,
2223,2014-11-01 10:35:18,"Works well, one star knocked off due to weird rendering problems of the one drive splash screen on startup (both iPhone and iPad).",4,False,Works well,or-ozz,
2224,2014-10-10 22:22:56,A real pain as you have to open the app to sync and if you come out it then pauses. Please fix!!,4,False,Does not sync in background,Andre 30000,
2225,2014-10-09 18:00:27,The new PIN facility doesn't work properly on iPad.  It doesn't ask for the PIN each time. Just once and then the app is open to everyone even when the app is cancelled and re run.,3,False,OneDrive,Mr Stovies,
2226,2014-09-05 12:02:16,It's requiring a full login each session and asks each time if you want to auto upload the camera roll. Then it just hangs saying there's 12 images to do. Not as reliable as you'd like to expect from MS,2,False,Broken,Mattt158,
2227,2013-11-26 07:21:35,"*Problem with SkyDrive for Mac/ *Use Google Drive and Forget the SkyDrive. 

I always get following  message, so I've deleted all (including all files & folders) and have  re-restarted all over again & again many times:- 

""Your SkyDrive folder may have been deleted or, if your SkyDrive folder is on an external drive, it may have been removed. Click OK to reconfigure your SkyDrive folder"" 

I recommend everybody to use Google Drive instead,  much better and more reliable!",1,False,Problem with SkyDrive for Mac/ Use Google Drive and Forget the SkyDrive,Sevenoaks,
2228,2013-05-12 21:33:46,It would be really handy if opening in the Microsoft webapp browser was available. ie: opening a Word document could launch the word webapp in safari ? At least that's the next best thing in the absence of Office for iOS.,2,False,Edit in browser,Simon50p,
2229,2017-07-19 22:45:47,Why the App is closing automatically? I can't see my pics. And sometimes it's very slow. Please rectify this as soon as possible,3,False,Can't see the pictures,Bhaj24,
2230,2016-04-09 16:55:43,Fantastic app couldn't live without it now,5,False,The business,hawk60,
2231,2016-11-01 18:41:02,Good way to share and save valuable information online,4,False,Online storage,Jai24200612,
2232,2016-05-11 06:19:24,Onedrive is easy to use and very handy when using devices with different operating systems.  It is however a shame that a huge organisation like Microsoft is wearing a misers hat when it comes to storage.,3,False,Improving app..miserly storage,iPad 2 convert,
2233,2016-04-23 09:40:38,"App just hangs since the last upgrade. Only went in as Microsoft just informed me the we reducing the free 15gb storage down to 5gb. The amount of money I spend on MS excel, word etc. And they are scrimping on some storage. Screw you Microsoft will be avoiding paying for your products in the future. You've just lost a customer.",1,False,Unresponsive.,Dusty1234,
2234,2015-10-20 07:18:56,"Good to see this app improving a lot better then other apps.
Good luck team!",5,False,Good to see improving,DigitalBerg,
2235,2015-12-17 20:50:32,I had same problem. I contacted support and they suggested above. All works fine now.,4,False,Delete App then reinstall - Solution,Jacqui Darling,
2236,2015-11-02 11:13:57,Worked perfectly for a month and now will not allow access. There are lots of users with the same problem. needs a fix soon or I will be looking for an alternative. Do not get until it is fixed,1,False,OneDrive failure,FFS anything,
2237,2015-09-11 10:28:34,Just set this up on your devices and it does the rest great,5,False,Great point and push app,Deemac5,
2238,2015-08-30 06:53:47,Great experience especially how OneDrive automatically backs up photos. Easy to use.,5,False,Fantastic app,Mattie moodle,
2239,2015-07-12 20:36:31,Works every time. Back up my windows phone no problem. Couldn't be without it.,4,False,Brilliant,Muinoc,
2240,2014-11-16 10:25:15,Use on all my iOS devices & works perfect.,5,False,Better than Googledrive,Brettskisky,
2241,2015-07-07 22:24:31,"Never wants to upload my videos, always says waiting. Photo are quick and fine.",3,False,Video waiting,Asap1984,
2242,2015-01-12 09:48:49,"This app used to let me stream audio files I saved on my drive, but that feature is now broken rendering the app useless to me, please fix it",3,False,Audio broken,Sgt. Pilko,
2243,2013-04-11 08:14:21,Cannot edit documents... Or if I can I cannot find it!,5,False,Not a patch on google drive yet,casserced,
2244,2014-10-25 06:34:20,"Google drive loads videos much faster than this, please speed up the load times. There's no point in storing videos on here if you can't even watch them!!",2,False,Need faster loading/buffering!!,Manga Man,
2245,2014-01-17 06:54:41,Current version crashes when trying to browse certain folders and it won't refresh the contents when pulling down the screen on these folders.,1,False,Crashes when browsing certain folders,JW73.1,
2246,2013-04-26 09:35:06,If it had support for multiple accounts and a delete all button it would be awesome!,4,False,Is ok,Wazza.hussain,
2247,2017-08-23 16:41:56,"Best app ever for stored pictures and documents, all pictures of my life in here",5,False,one drive,Daga_1982,
2248,2012-12-05 21:17:12,"Deleted unwanted shared folders from random people that i do not know from my sky drive on the computer, but they still appear on the app? 

Anyone with any ideas?",3,False,Synchronisation,S.Heera,
2249,2016-10-29 22:12:22,Was great but now they expect you to pay for storage so now it's useless..,5,False,Gone from 35gb to just 5gb,Hillystriker16,
2250,2017-07-14 19:59:07,"I've used this app for the past 3 years and regardless of updates, it still goes through long stages of crashes and glitches. Overall really disappointing.",2,False,Not what it should be,mlandoz,
2251,2017-06-30 08:39:41,This app used to work with my office 365 work account. It's stopped working. When I want to edit a document it asks me to sign in. It takes me through the signing in process and then says I can view but won't let me edit. Online version works fine!,1,False,Not working!,Jillykins,
2252,2016-02-02 11:28:12,"This app is easy to use, affordable storage and saves most things.",5,False,"Brilliant, affordable, storage",Mr Moneypenny123,
2253,2016-06-08 09:22:09,"Why would anyone try to fix something when it works perfectly fine? Hope MS do not discontinue the old one in App Store. I can't even log in to the new app, switching to the old app.",1,False,Can't get the new app to work with my office account. The old app worked perfectly fine.,LordLordy,
2254,2016-10-11 21:53:33,"I enjoy work and business aggregation, and forking with files is great, as I have Office 365 subscription.",5,False,Been great so far!,Solorun,
2255,2014-11-19 12:35:06,"Poor functionality to open accompanying Microsoft apps, constantly requires me to log in, loses files sometimes, difficulty renaming files and folders, can't copy and paste documents, needs to update files quicker, URGENT UPDATE REQUIRED",2,False,Poor,abbecus,
2256,2014-05-14 20:46:30,"Got this app with the intention of uploading videos more than anything which it does slowly but when you try to play them afterwards they don't work, this has happened on 2 phones, so if it's videos you want to back up absolutley don't get this app, it's useless",1,False,Not Happy,Wotteva,
2257,2013-12-25 16:39:52,Forcing me to upload photos to sky drive by putting bubble notification as soon as i click a pic . Tried turning off photo upload. No use !!!,2,False,Annoying bubble notifications,er.subin,
2258,2012-01-13 00:51:17,"25GB of free cloud storage = iCloud x 5
Real Cloud storage that will not delete photos after 30 days and is the biggest you can get on the iPhone. Pair it with photo gallery is good but a true smartphone should back up automatically.

Stupid mistake for forgetting to add a mass upload button. While iCloud does it when phone is locked and plugged. 

Shame that this could have been better than iCloud if they link it with mesh better. 

1star for half-hearted work.",1,False,Getting there little Microsoft =),Cheer You in the Cloud,
2259,2017-02-20 16:35:04,Makes a fast internet connection seem so slow. Pictures taken forever to load and 99% of pictures are fuzzy- they don't load in full quality.,2,False,Bad,DwightKC,
2260,2016-02-03 21:55:47,Use for work and fun! Sending files straight with email is so useful!,5,False,Top app,K.theod,
2261,2016-05-09 12:14:53,A great way to stay up to date with files on the move.,4,False,Used to work great,qirex3093,
2262,2016-04-28 07:26:22,"The app is okay and it is useful to download pictures straight from your phone. However, as Microsoft are reducing the storage by a huge amount there is no point in using Onedrive. I have shifted to Google pictures which is far superior. Goodbye Microsoft!",1,False,Not the most user friendly,Mark in Bath,
2263,2016-01-15 17:50:04,"Can you enable the app to add documents from other sources like scanner pro, document converter and keeper vault.",5,False,Add items,PheonixJnr,
2264,2015-11-18 15:14:25,"Bought the extra 100gb for a year
Worth the money",5,False,Great app to back up iPhone,Redbum,
2265,2015-09-03 17:31:20,Superb storage and easy to use! Couldn't recommend it highly enough... 5 Stars!😀,5,False,Best Storage App Around!👍,Franco 79,
2266,2015-11-16 07:59:38,"Just going round in circles on my iPhone on ios9, won't open any files but keeps asking for sign in information which I enter, and then I get sent straight back to enter it again! Annoying.",2,False,Not working on iPhone,SixStringDubber,
2267,2015-05-24 03:49:43,"Great App, especially as limited storage in my iPhone.. I've yet to have time to sync it with laptop/printer.",5,False,Brilliant,Anyone 4 Tennis !,
2268,2016-04-03 12:31:57,Meets all my basic needs. Can't think of any user friendly app.,5,False,Awesome app,Bwakoharaa,
2269,2014-08-26 12:28:41,This was once a great app but now crashes about 10 seconds after opening every time i open it making usage impossible. Please fix.,2,False,Latest update ruined it,Olly_25,
2270,2014-04-21 19:59:53,App quits when camera backup is turned on.  The only way out of this is to delete the app and download it again this time making sure the camera backup is turned off.  Useless!,1,False,Quits when camera backup is turned on,k99ward,
2271,2014-03-06 09:02:47,"I like this app, everything syncs from laptop to iPad. 
But some graph or table can't show, and show in strange way... ... etc.
I hope these can be improved. Thanks... ...",3,False,Something to improve?,May SM Wong,
2272,2013-09-23 23:11:35,Not a bad app however it would be top class if it was possible to email files straight from the app rather than having to share by sending a link via email. Sad that i have to use another app to work microsofts sloppy skydrive,1,False,Useless for business,Scottish Beek,
2273,2013-08-24 19:26:20,It's works well enough I guess but I only downloaded it as a simple way to get a video onto my iPod. There is no feature that allows you to download to camera roll or videos so it was kind of pointless to me,2,False,Good enough,Laurenlovesoreos,
2274,2015-10-04 22:42:28,"Love it.
Ive been using OneDrive for years now and I am really happy with it. i would recommend definitely",5,False,Mrs,HotieHotie,
2275,2015-12-17 19:41:56,"I have used one drive for as long as I can remember, since the update yesterday 16th Dec I can no longer see any of my files or photos, thousands of pictures gone....
There visible if I log in online to one drive but the App has totally failed on the iPad.
Very very annoyed.",1,False,Total Fail 😟,Pinkypurps,
2276,2015-12-17 08:29:41,"Since update one drive no longer works! No photos will load, just a default logo for each photo! It makes you wonder what type of testing is actually done before an update is released to the general public.",1,False,Update has broke it!,Clarkeg,
2277,2015-12-16 19:40:35,"After the latest update I am unable to view my photos on the camera roll and also unable to view my word docs, excel docs and pdf files. Hope this problem gets sorted quickly. iPhone 5s user.",1,False,One Drive problems,Right first time.,
2278,2015-11-06 03:35:42,Such a rubbish app! So disappointed as I expected a lot more. Feels as if the app is back in 1980's :/ come on please improve the functionality! My files are taking forever to be uploaded and I'm still waiting for over 2000 pictures to be saved since April 2015!!,1,False,Expected way more!,Haaa:),
2279,2015-10-03 16:40:11,"It just does not let me sign in.. Keep showing the error reading 'Can't sign you in currently. Please try again later.' Pointless to have it, if you cannot sign in and remotely access your data. This app doesn't really serve the purpose. Please fix it.",1,False,Sign In Issues,Dharammp,
2280,2015-07-19 12:12:26,"Great app, makes it really easy to  share files between devices 😊",5,False,Great app,Themuse08,
2281,2013-04-04 18:21:26,"It Works,better than ICloud that's never worked correctly on my PC.",5,False,Great,Michael UK,
2282,2015-07-11 00:25:36,I am a researcher and mainly store my readings on clouds. I cannot read pdf documents within the app as it immediately crashes whenever I zoom in a page.,2,False,Crashes when Viewing a pdf,Angry_disapponired,
2283,2015-06-10 11:53:35,"Uploads pictures quickly, but you spend more time looking at the loading wheel as everything is so slow.",2,False,If you like looking at the loading wheel you'll love this.,Hadi365,
