,date,review,rating,isEdited,title,userName,developerResponse
1413,2016-12-24 23:45:15,"This app gets better with every update. I rely on it weekly and it rarely lets me down when it comes to viewing and organising files. It was recently updated with a scanner function which can be used to scan in documents, cards etc. It works well on the whole but would benefit from being able to merge individual PDFs into one document. Add this feature and you'll have many very happy users.",4,False,Regular Updates. Well Constructed.,CrackerJack42,
1414,2017-06-15 23:11:06,"I recently switched from Dropbox to OneDrive because my limited storage space with Dropbox was running out. I use these web services to back up my files so I don't have to sync them with my PC, honestly it's perfect, so easy to use the app and it has some lovely features. I thought Dropbox had it all, OneDrive is forever my favourite! Try it out, you won't be disappointed!",5,False,Perfect for personal use,Joshua Ettery,
1415,2015-10-01 23:24:58,"I like OneDrive a great deal. It keeps everything in sync nicely across all my devices and platforms, and has the best web interface of any similar product, for my money. It doesn't hurt that it's very generous with storage space either.

Thanks to the developers for solving the annoying privacy issue when switching back to the app with a PIN or Touch ID enabled.",5,False,Works well. Photo backup especially useful.,rolphus,
1416,2017-01-22 19:03:07,"Work goes ""Google"" and I go MS OneDrive. Who has made the best decision? At this stage, I find MS more intuitive. Some funnies, like moving folders can only be done in portrait(?). Even better integration with iOS Word etc, so docs actually open seamlessly in Word would be great. OneDrive offering a full ""Word"" (etc) style read only preview would be good too. Final request - an option to pay 79p per month for 50GB storage, to match Apple. I would move photos in an instant then! Keep going MS.",4,False,Moving to the cloud,Will43675,
1417,2012-02-18 19:45:55,It's great to have something to back up all of my photos and music onto - I talk as someone who recently had a bit of a technical hiccup in which I nearly lost everything. My only issue with this version of SkyDrive is that you can't upload multiple files... and I have thousands that need uploading before I plug my iPod into my reformatted laptop for the first time. This is going to be a long night...,3,False,"Needs a Multiple Upload Feature, Otherwise Useful",Sir Kelsalot of the Many Hats,
1418,2015-08-26 09:35:05,"OneDrive is my main cloud service and I generally have to problem with this app but this new version has brought up some problems. The main one is that the older photos in my camera roll that hadn't been uploaded before this update are showing up in the Camera Upload list but aren't uploading at all or one gets uploaded and the rest stop. It would be great to fix this and I'm sure there's already a bug fix on the way but aside from that problem, great app.",3,False,I love this app but not this update!,BronaghD46,
1419,2015-07-02 22:06:40,"Don't trust this app to backup your photos unless you're prepared to babysit it and check its doing its job every few days. It will frequently just skip photos I've taken, or get itself into a state where it can't load any of my folders.
How can Google release an app that works fine with version 1, yet Microsoft can't get it right after numerous versions. 
The Windows / Mac versions are equally as poor, again a small company like Dropbox far surpasses Microsoft in terms of pure reliability.
It's a shame as the pricing it good, but you can't put a price on lost memories - so I can't recommend this app.",1,False,Very poor - you'd expect better from Microsoft,M4RCUS2000,
1420,2017-07-23 14:22:03,"Great app for offline storage. Obvious I guess but excellent integration with Office 365. Makes using Microsoft Office a breeze on IOS Hardware and lets face it Apples Office suite leaves a lot to be desired, in my humble opinion. Also with a 365 Subscription you get 1TB of Storage, what's not to love about that.

Excellent for streaming your music collection through the Groove app (not rated 5) to Xbox one, Windows 10 hardware, iPhone and iPad etc. etc. etc.",5,False,Seamless integration,ppr,
1421,2012-08-04 08:42:02,"In terms of functions it the same as google drive as the app only opens pics and documents but it looks nicer then g drive, skydrive is expected to play music and vids soon. Also really good value. I bought 50gb for £16 and that's enough for all my pics and vids. When the music player is added then I might upgrade my storage and move my music in to it. In terms of functions Dropbox is the best but it's much more expensive to pay for extra storage.",4,False,Nicer then g drive,gavo360,
1422,2016-01-31 17:22:41,I use several different cloud service and decide to use Onedrive  for photo back up because it provides more cloud space. But why the function cannot run in the background?? Please use your brilliant mind to tell me how you can take a photo and use one drive at the same time?? And also every sometime when I open the app it says something wrong with my  login and all the back up function has been stopped !! Can you understand the pain that I have 899 pics to be uploaded and I have to keep the phone awake for several hours??,1,False,"If a photo back up service can't run in the back ground, then it's rubbish",ronal9527,
1423,2014-06-11 22:25:26,"Great app and one drive itself is an excellent option for cloud storage and would have given 5 stars but lacks some basic but important features such as
Ability to 'search'. It's so important in this day and age with users potentially having thousands of files. Especially for extra paid storage. Surely a simple fix. Never one to complain but come on Microsoft this is a staple option in a file management app these days.",4,False,"Great app, but...",billybiglix,
1424,2015-11-23 15:28:18,"I used one drive for more than a year and it really has started to come together over the last few updates. 
Saving files from email and other app into logical folder locations now happens with ease, as does renaming folders and files. Currently accessing over 500gb of stored information from my iPhone and iPad, PC and laptop.   Very pleased",5,False,Improving all the time,NigelbobClark,
1425,2016-04-01 12:25:50,"Its perfect ,  but could be even much better for photographer when we carry our photos to show , we need our photos in full ultra high definition quality and they have to have fast buffer so consider in this issues please. 
 For normal use its outstanding and it's easy control via mac , windows , smartphone and tablet. Love this . And highly recommended .",5,False,Its perfect for all users .,Nabaraj2frank,
1426,2014-12-31 08:56:37,"For me, the killer feature is the real time auto-backup of the iPhone Camera Roll (esp since Apple iCloud only introduced this feature in iOS 8.x, which is no good for iPhone 4 users).

Unfortunately the OneDrive implementation is critically flawed/buggy ... 

1. It pauses auto-upload when the app is in the background (even if background usage setting is enabled in iOS ) - there is a big thread of complaints about that on MS support pages

2. I have 4500 photos on my camera roll. It's backed up the last 600 or so (poss since I installed OneDrive) but has ignored the previous 4000 and claims the sync is up-to-date

So frustrating - Esp since as a long time hotmail customer (15 years) I have 30 Gb of free OneDrive space I want to use

My only option is a manual backup and try to keep remembering to do it regularly 

If MS fix these issues they could compete against iCloud ...",2,False,So much promise - but it's broken,Jimdennison,
1427,2016-09-19 08:33:33,"I've always used this to save space on my phones, take a picture and it goes onto this app and i then delete to save space on my phone, i now have a 128gb phone so saving space isn't important BUT i still use this app as it gives me security that if i lose my phone i don't lose my pictures, excellent app and highly recommend it.",5,False,excellent,john1073,
1428,2016-09-02 12:51:09,"I am not satisfied with this item at all. When I try to save a file from Dropbox to onedrive as a backup I get ""upload failed - file location changed during editing"". This is a new problem as I have successfully been backing up my files from Dropbox to onedrive for many months.
I have decided to stop using onedrive as a backup source.",5,False,A Review of Onedrive,Sobrills,
1429,2017-02-16 16:38:08,Very good app. Able to attach multiple files including documents and images. But after reading messages. Notifications stay in home screen. Not updated properly. Hence not 5 stars. Hope Microsoft can fix notification issue asap. Also need to expand the view message while tilting phone to horizontal position. Difficult to read.,4,False,Great app but notification not updated properly,OZIQBAL,
1430,2016-06-16 16:37:08,"I love this just for my photos, I have over 30,000 photos uploaded to one drive and to have access to all of them is just brilliant. Also my iPhone photos just backup without me doing anything is fantastic. 
I trust this app more than Apples for my photos even though all my kit is made by Apple they still do t seem to do the cloud properly. (Shame)",5,False,What a great service,Dio99,
1431,2016-07-09 13:42:39,"I have used this app throughout the first year of my mental health nursing degree, I intend to use it forever. It has been essential on many occasions where I have been unable to access my files for one reason or another, I have used it to share files with colleagues, and to access files from the most bizarre of places. It is a (won't say God, as I'm an atheist) Mother Nature send.",5,False,Invaluable,Jamesandthegiantliver,
1432,2015-06-13 11:44:09,"I have several text files on my onedrive with different extensions, I really need a way to open them as plain text or ability to handover to another app like safari. Currently I am having to change the extension to txt on pc. 

Other than that I like the app, generous storage is a bonus.

Latest update required me signing off and back on again, not a big hassle. Those of you complaining about loading forever might want to try this.",3,False,Text view is much needed,de@dlock,
1433,2012-11-08 12:42:24,"This is a good app but a few little niggles are there at the moment .
If I have loads of pictures to upload I can only upload 6-10 at a time or it will crash .
But I can start off by doing 6-10 go back do more and more and more so I could be 100 plus I'm uploading at once .
Not sure if its a max amount set by Microsoft or buggy app but this is the only long way around large multiple uploads",4,False,Good app but needs fine tuning,MAILROOMMAN,
1434,2015-04-30 13:47:18,"Much prefer the Microsoft One Drive to any other cloud I've used. It seems the easiest and most intuitive for me after X years of Windows.

I've given it 5* as great for docs/pics, but greedy me would like to create playlists for the music and/or have it link with music player apps - but maybe I just haven't figured that bit out yet!",5,False,Easiest cloud I've used,Señorita Hez,
1435,2015-12-16 23:41:53,"I've just done the update but when I went to see the pictures they are not shown. The banner on top says Camera upload up to date but when I open then there is only the icon of onedrive. I hope that pictures, video and documents are still there😞. Fix it please. Thank you",5,False,After update is not working,Cop ip,
1436,2017-08-16 20:10:57,"I no longer keep any hard copies of any documents. I save all correspondence, bills, etc to OneDrive. I can access any document on my phone or laptop at home or when travelling with work or on holiday. It makes life so much better. 

Only once, thus far, has a document got corrupted / not saved correctly. And although support did respond, it was painful and not successful. Hence only 4 out of 5 stars.",4,False,Great - my entire life in my pocket,JustMe2018ad,
1437,2014-02-03 01:21:43,This app has been amazing in helping me keep my pictures organised. It backs up all your pictures to the drive so when running out of space on your phone just back up the pictures and delete them from the phone. With the app you can access them at any time so its really convenient.,5,False,Best app. Really helps if you have a lot of pictures,Lucas.paiva,
1438,2014-05-29 21:22:17,"On the whole a mixed app, works fine at times and runs smoothly when it ""wants to"". Doesn't seem to have support for for Onenote (crashes every time I try to open the folder with the file). Has the tendency to mess up layout of images in word documents and ends up covering parts over, fine for reading blocks of text but ruins full usage for things like university notes. Could be great app if crashing and layout were fixed, otherwise generally unimpressed.",3,False,Meh,Wingstrike,
1439,2016-07-21 17:47:06,"Have been a user for many years, during the years that online storage has been going up and up - then get told ""oh, no, you've got to take stuff off"". 

Unbelievable, have never experienced a cloud service reducing my storage before!! Have done their workaround, and set four alarms to make sure I turn it off before it charges me next year. If they do manage to charge me, more fool me!!!!

Utterly ridiculous, don't sign up to this cloud service if you believe you can put stuff on it and then delete it locally - they reduced my storage by more than half!",1,False,Can't believe this is real,Vauxhallmark,
1440,2014-10-05 18:40:23,"So OneDrive is without a doubt my favourite free cloud storage facility. It works well on all my devices. I access it from my iPhone, iPad and PC. It's easy to use and the UI looks really nice and professional. Easy to keep good file management. At the moment photo backup does not work because of incompatibility with IOS 8 however I do not use this feature. Very happy with the OneDrive app.",5,False,Very good,ImUnonumous321,
1441,2012-06-13 20:03:39,"Keeps asking me to connect to wifi, which is connected for all my other maps.  Used to work fine, the latest update seems to have killed this.  Smaller files seem to be opening fine.

Fix this and it's worthy of a much higher rating.",5,False,Latest update has killed downloading large files,Young Robbo,
1442,2016-01-20 08:40:36,"Been using this app for a couple of months now. Working perfect on my pc, laptop, iPad and iPhone. I take a picture it goes on all devices. Only had 1 issue where I thought I'd lost everything. I switched the app off then restarted again after an hour and everything was back. Only ever happened once.",5,False,Perfect,Evy1912,
1443,2017-08-31 10:00:25,"Does the basic stuff well but needs to be more user friendly. The features that aren't as good as they should be include moving files between folders, renaming files during upload and upload speed (even on 4G and good wifi). Being able to create a list of shortcuts for frequently used folders would be great too.",4,False,Good but needs to be better,Ash.x.b,
1444,2016-07-29 19:50:12,Had this since it came out was great had large back up originally then tells you that you have to pay to keep amount of photos you have stored because they have lowered the amount of storage you can have free would have been a nice gesture to allow you to keep what you have and pay extra for more which I would of done happily but because there was no option I bought a back up stick to save that then put on pc to save on Dropbox instead,2,False,Had to delete folders,Williamlfc,
1445,2016-03-30 21:58:09,"Not bad, but it's glitchy and crashes a lot. It behaves unexpectedly in a number of ways and I'm just waiting for it to lose one of my files (in fairness, it hasn't done yet). 

I had to sign in three times; once to open the app, once to look at my files and again to open a file. 

Over all, it's feature-rich and shows promise, but it feels like an app within an app (which would explain the multiple sign ins) that isn't talking to itself very well, so it needs to be cleaned up a lot.",2,False,Nice idea but glitchy,The Anonymist,
1446,2014-10-02 05:28:27,"I am not a great fan of cloud storage but needed to free up space on my iPad,so gave a number of these app a try, this is the only one that has worked. It's very easy to use and unlike other reviews I don't need it integrated with twitter or Facebook what's wrong with people if they want to do something with a photo email it or message it to them self or keep the thing on their device!",4,False,Better that I thought,007dodi,
1447,2014-07-06 07:19:05,"To Fattyyyyyy, I am not sure if this helps you, but it has fixed the problem for me.  I found that the folder types in my OneDrive were set to Picture folders, not Document folders.
By selecting the folder in Onedrive web application, the properties have a ""Folder Type"" when you click on the change hyperlink it gives you the ability to change the type from Pictures to Documents via radio button.
Once I performed this task all of my folders appeared. in the iOS Office Apps.",2,False,Missing OneDrive Folder,LoneRanger+Tonto,
1448,2017-01-16 07:18:52,"It's ok except the really annoying need that one drive seems to force you to sign in again and again each time you open it after a while, typing out email and password to access one drive on the one is annoying might as well not bother with the app. It's especially annoying as it does not allow you to use safari password manager! Please fix!",3,False,Constantly having to sign in again!!,tbh_29,
1449,2016-04-24 13:31:58,"The iPad app makes it very hard to find what you want (completely different layout from the getting started PDF!!) such as who you've shared with. Nor can I tell if the sharing of a folder has been successful. 

Just doesn't inspire confidence. Particularly as my partner hasn't received a sharing notification, despite it showing the folder as shared with her. 

Nightmare of frustration.",4,False,User unfriendly.,htresidder,
1450,2015-12-02 12:03:39,"I had originally thought it lacked the function of multiple selection for deletion or moving to a different folder, but then I found this in the top right where the three dots are. It is a wonderful app. So useful to be able to access remotely documents, data and pictures which are on your PC.",5,False,Excellent App,April May June may not,
1451,2015-09-03 16:32:07,"Every update of this app seems to want to upload all the photos and videos on my iPhone (again). A tad annoying when I have an intermittent (guest WiFi) and generally slow internet connection. This update is no different. Over 1000 photos now uploading even though they have already uploaded, at least twice now if I recall correctly. This update cheerfully announced that background sync was improved. Not for me it's not. Battery life when the app is running is also dire.",2,False,Painful Update,DinoH2IK,
1452,2015-08-10 18:56:34,"You guys have done an awesome job with this app but it still needs a couple of tweaks. 

It needs detection for duplicates badly. I normally take photos on iPhone and then AirDrop them to my iPad to view at a better quality. However, little did I know that this app would upload both photos. 

The app also needs ability to choose upload quality. Right now, I don't know how much my images are being compressed. From what I can tell, they are and I'd like that to stop.

Otherwise, from the UI perspective, this app is great. Does what it says on the tin and I can't complain otherwise. Few more features and I'll definitely rate five stars and tell everyone I know about it!",4,False,Needs to detect duplicate photos,Manthanhd,
1453,2013-07-01 00:06:52,"Great soft ware but to compete with Dropbox you need to include the automatic camera roll upload, them I wouldn't have 1 bad things to say about skydrive, apart from that, skydrive is great with its generous storage limit you can store all of your photos videos and files, upload and download from any device you like :) great job Microsoft, just add that 1 feature then you'll get 5 stars and everyone will be happy :)",4,False,Average,Peter Jaworski,
1454,2016-01-28 21:49:34,"I use Dropbox and iCloud.
More recently using Onedrive as I think it has the potential to be more secure.
Seems ok and getting better, but still has some way to go. It's not as intuitive as Dropbox, and in some areas is downright clumsy.
Trying to access help is a real problem; you can find it eventually but searching Onedrive Help in my browser (chrome) is useless - not even a link to where the actual help is located!",3,False,Room to improve,Gabriel Oak,
1455,2015-08-10 20:58:59,"I had a rant to myself the other day with the original app about not being able to upload photos to it- hey ho this app allows it, meaning you don't have to waste storage space on your phone for the photos and gone are the days of having to plug your phone in to upload photos. Well done Microsoft.",5,False,fantastic,Cdc104,
1456,2015-05-27 17:16:10,"Too many times I used to get stuck with 'Storage Full' messages and couldn't take any more pics at a crucial time (we all take too many, just because we can these days!) Now all I do is back them up to my cloud, clear my Camera Roll and carry on taking pics! 😜",5,False,Great for clearing my phone to give me more storage,mikeparnis,
1457,2015-12-18 07:43:43,"After the disastrous update the other day, it seems MS have listened to the complaints of us OD users who were unable to access our files. It seems fixed with today's release. Lesson for MS; next time check your updates work before you release them into the public domain.",5,False,Glad to see it is fixed,Myrm,
1458,2016-02-09 07:49:22,"Using it on an iPhone 6 and it crashed each time it opens, originally it was slow to recognise the new photos and nearly every time I start the app it required me to sign in so therefore not uploading the files in the background like the app suggests.
Would be happier if less human interaction (baby sitting) was involved to make sure it was working but overall on par with photostream as the slowness is counteracted with the video and basically unlimited photo storage.
Overall a good idea but the software is just too ""crashy""",1,False,iPhone 6 keeps signing out and now it crashes,Silver House,
1459,2016-10-30 23:16:25,"The latest update caused my iPhone to be glitchy and unresponsive.
The iPhone camera roll then crashed when trying to upload new photos, it also missed some photos out (common problem that Microsoft still haven't sorted after 4 years!).
I thought all my phone pictures were gone then it got stuck in a cyclic loop while trying to restore photo library. I uninstalled onedrive and all the problems went away. I reinstalled it and it came back. The app is definitely broken...
SORT IT OUT MICROSOFT!!!",1,False,BEWARE!!! Makes my iPhone glitchy and unresponsive,Dan_the_man1412!,
1460,2015-01-11 21:57:18,This works great and mean you don't have to worry about losing important docs and pictures. Easily see everything on all devices too. IOS8 is a bit of a pain though as we have the wifi drop problem which Apple has failed to fix so sometimes uploading is intermittent,5,False,Does what it says on the tin.,tkdsouth,
1461,2016-02-21 14:08:03,I was looking for a why to transfer my photos and documents from my iPad to a portable drive on a Windows PC. All the usual problems with Apple products and comparability with Windows. This allowed my to store my photos and documents in the cloud and transfer them to my portable drive without any problem. Solved my problem and gave me loads of extra storage for iPad and PC.,4,False,Useful Storage Solution.,Dodger2010,
1462,2015-04-03 16:07:54,"If you're thinking OneDrive would be a great place to backup all your iPhone photos, think again. With a Federation 365 account you can upload photos, by tapping on each - I've 1900+ to backup, so pretty tedious... But the real killer is they get uploaded as size 'medium' which loses most of the original resolution, hardly a backup of what was a high quality photo.

How can this setting be changed? Is this done just to reduce cloud storage space? I guess the work around is to copy photos to PC, then upload to OneDrive. Hardly the seemless experience I'd hoped for.",1,False,Lose your photos,TaffyTech,
1463,2017-08-18 11:12:40,"I have used OneDrive since 2011 when I enrolled at university and use this app for all my documents, whether they be personal, assignment based or part of my reading. I particularly enjoy annotating notes and highlighting text in law reports and academic papers. An invaluable app that I thoroughly recommend of all students and lecturers.

Mark R Cranwell",5,False,An Application for all documents,Mark Cranwell,
1464,2014-05-26 08:31:09,"The one drive is pretty reasonable at managing your one drive and love the backup of photos to one drive. However it is lacking tools to use the files. For example being able to download photos back to the iPad is very painful as you need to do individual downloads.

If the developers integrate the app a little further into the iPad environment then I think it will be a very valuable tool.",3,False,Fine app to manage your one drive but lacks integration,Simon Doy,
1465,2017-04-11 20:58:01,"As a teacher, I need something reliable that allows me to amend and create documents easily at both home and school. When I use OneDrive, I feel at ease because I know that even if I do forget my USB, I will still be able to access my resources. I find OneDrive much easier to work with than Google Drive.",5,False,Lifeline - I depend on this.,chloe_knowles,
