,date,review,rating,isEdited,title,userName,developerResponse
0,2021-12-21 20:23:32,"Onedrive is an outstanding app that is clearly showing itself as one the most important and convenient apps for any person. This app is a must-have for anyone with many documents to handle, because it is not only very easy to use, but is great for saving your work. You’ll be able to save your work anywhere, whether it’s the overall Onedrive or a specific folder. This app clearly demonstrates the meaning of ‘helpful’ because all of us students always have our work ready to hand in. It’s very easy to create folders and offers fast syncing. The functionality and design is gripping; the app is also free, just like the other office apps. Thanks to the fact that I can manage a single office account over many devices, I never have a problem with uploading assignments. And lastly, Onedrive also allows you to save photos and videos for memories; so why not make a new folder and save all of it there? You can even purchase deals that are very good for the price - a $9.99 monthly home subscription for a family is fantastic as it offers 1 terabyte for 6 family members. Plenty of data for the family. Thank you for proving that you guys are the best, Microsoft. Deserves more than 5 stars.",5,False,Amazing and very reliable!,Freewiseguy,
1,2019-09-08 22:07:36,"This app is second to none. I use my onedrive for everything from college (now uni) to home files. I have something like 4 years and about 300gb of photos and videos backed up which I can access so easily across any of my devices, no matter the platform. One of the best things about Onedrive is how universally accessible it is, but also how well it works and the fabulous functionality it provides. With the recent update to the application interface, it is really easy and pleasant to use. The development team are truly incredible and they really seem to take on the feedback of their users. The app is regularly updated with USEFUL updates not just the usual “bug fixes” or “performance improvements” like every single other app seems to do. 

I have tried using a range of other services such as google drive, ICloud Drive and Dropbox, but onedrive is simply the best in terms of functionality, compatibility and features. For £6.99 per month I get 1tb of storage with full access to the latest Microsoft office applications, which is really handy. 

One final thing to mention is that onedrive is a good idea for photos if you have a windows computer, as photos you upload to onedrive will sync to the photos app in windows, meaning you can see them all seamlessly on your computer.

Big thanks to the team who make Onedrive so truly brilliant!",5,False,Outstanding,Zoltage,
2,2020-07-10 16:51:44,"I really love Onedrive in many ways and I am a paying subscriber. I use it mostly to store all of my photos going back over years and I love so many things about the app. However, there is one issue which is huge for me and I am borderline on switching to another big cloud provider because of it. I checked - they have this feature. I don't want to switch, it's so much work, but this really bugs me. The issue is, for whatever reason some of my older photos (5+ years old) uploaded without the exif data for date created. I don't know why because the correct date shows on the (1yr old WD) hard drive they were uploaded from, via windows 10. I thought ok, they're old photos. The big problem is I can't edit the date the photo was taken on Onedrive. So, very old photos show up in my chronological photo timeline as having been taken this year, because Onedrive assigns their upload date to them. This disorder pains me and makes looking through my photo collection not enjoyable. Please, please add this feature ASAP. I will have to move cloud providers if I can't fix this.",4,False,Please fix this one issue!,AM1258,
3,2019-05-24 23:14:34,"For all I love the simplicity of One Drive. I pay a subscription monthly yet as in previous comments. The app forgets where it is navigating to or asks to open in browser then loops back again to ask to open in browser. 
The folder files are always a different look to how they looked on the app And in browser, or if on a pc or iOS device. So then caused a little confusion in where I had saved it too. 
Also managed to not save my work when my phone ran out of battery. I tried finding the lost file in last place I used it and the folder I had opened it from, looked through the temp folders etc. By then I had no choice but to sit and redo all the work I had previously completed. Disappointed by some way, I pay a monthly subscription but I think one drive has become too complicated trying to do all things for all apps. 
Also I have a personal one drive that I didn’t mean to share with a group Of colleagues which contained all my personal files. So it is far from bomb proof. 
Best wishes and hope you can make one drive a stronger stand alone app.",3,False,One drive,K Peebles,
4,2021-02-25 11:12:23,"Use this app on a daily basis. Brilliant app as can make stuff available offline (which is a godsend in my work as can’t have devices connected to a mobile network at certain times) so this facility is perfect. 

I have loads of files, rule books etc. that I need to use and have digital copies stored online and this works great for me. 

However, this app does not “talk” to the Apple developed Files widget. It also doesn’t show documents in the recent section of the files app. Now this could be Apple or Microsofts end. I have contacted Apple and asked them to look at it but need Microsoft to look into it aswell. The Files widget on one of my homescreen pages would be a brilliant addition as it would be one touch access to certain files I use often but as it stands, this isn’t working at the moment so it would be great to get this working properly.",5,False,Great app...,PU6HY,
5,2020-09-10 08:04:51,"Good in parts! I’m a subscriber to Microsoft 365 but I’m beginning to wonder if, as a retired home user, it’s worth it. I haven’t had issues around synchronising between devices (I have a Windows 10 laptop, an iPhone and an iPad) and nothing has ever been lost. In addition I get constantly updated Office, although, now retired, I don’t use it much and the free Apple alternatives would be quite sufficient for my needs. Also my wife and daughters can have the same benefits at no extra cost. But I’m not sure if they use it! 
What I really miss since recent updates is a decent search facility. Tag search in photos was never great but it’s disappeared entirely! I’m glad all my photos upload to Google Photos as well; Google’s photo search is superb. Searching files is a shadow of its former self. Search within a folder no longer works. It searches everywhere, whichever option you go for but still doesn’t locate many files, certainly not for a term within files which it did once upon a time.",3,False,A Curate’s Egg,Haworthman,
6,2019-05-30 11:55:14,"The one drive app is so useful. I use this for my assignments in college, and after nearly a years use, I can say I couldn’t rely on anything better to keep my work safe, secure, and in a better place. I have also been able to download the app on my phone so when I’m on the train I am able to put my data on and carry on with my work. I’m impressed and one happy individual!  
Me and my sister were sat last night at her table and she expressed she is not able to get onto her Microsoft word. I told her not to worry, I explained about one drive and how she can use word on there and save her documents; now she is also one happy and impressed individual. I would definitely recommend one drive again to anyone as it is a very useful tool. 

Thank you One Drive!!☺️",5,False,Outstanding!,BethLove17,
7,2023-03-05 06:37:32,"Overall this is a good app never had any real issues with it.
However it is constantly asking me to set up my personal vault, I do this every couple of days, highly annoying when your wanting to save something and you can’t because it is asking you to do something that you have done many many times previously, and you have to start again, once you’ve set it up, again!!!!!!
Personal vault also locks after a time even though you are still actively busy in it, why?  If your busy in this location then it should not be locking. It should only lock when your not busy in it.  If it does this when your busy creating or uploading to it then you have to start again.
Never have these issues with other cloud based drives even though they have similar features.",4,False,Good App but also in part annoying,AdLondon100,
8,2021-05-06 09:53:06,"I’ve been searching for a replacement for Google Photos for some time and I’ve tried pretty much everything. My search came to an end though when I tried OneDrive. The way that OneDrive handles photos is excellent. The full bleed, grid layout is really nice to work with and scrolling through years of photos is buttery smooth. Being able to zoom in and out in the photos tab is really nice. 

For those looking for more storage space, make sure you run a search for discounts before you pay the full amount. There are loads of ways to save money out there. I used a 50% discount via the Microsoft Home Use Programme that my work has signed up to.",5,False,Excellent photo support,Matt Morelli,
9,2018-01-14 22:01:01,"There are many things I dislike about Microsoft office in general and its limitations on iOS:

1) The apps themselves may be free, but the subscription isn’t.
One of my main reasons why I only use office for work is how there is a yearly subscription that has to be paid. Luckily I am not the one needs to worry about paying this, however I am appalled at how normal home users need to pay a subscription and cannot buy the software outright. There are many other apps which can do everything that this range of products can do (and more) which are free or paid for in one purchase (iWork and G Suite for example).

2) Ties you into the office ecosystem through a horrible file system.
When saving a file (like a word document for example) the app defaults to either using your OneDrive (Microsoft’s cheap-expensive version of iCloud) or a terrible iPad file UI. (The app does offer alternative cloud storage solutions but suspiciously DOES NOT include iCloud in this extensive list)

3) The lack of support for iOS features.
Office does a fantastic job of not keeping up to date with the operating systems. The apps feel like they were made for iOS 8 because of their clunky interface and lack of other features like support for iCloud or drag and drop, the latter of which was introduced in iOS 11.",3,False,Avoid office whenever possible,CWainwright26,
10,2020-05-28 07:31:21,"I used to use Google Drive, but switched over to One Drive when I purchased Microsoft 365 for my University Course. I have to say, I found Google Drive to be FAR more reliable than One Drive so far. Yesterday I uploaded several documents in to a shared folder for my mortgage advisor via my desktop pc. They’re all present and accessible from there, but if I try to view the files on my iPhone app they’re not present - even the new folders I created don’t show. Sometimes it takes days for them to appear which is no good to me if I need to access them on the move.  If I try to share a file from my phone with One Drive it often says ‘uploading’ but just hangs - I have to cancel the upload, and try again directly in the One Drive app. If I didn’t prefer the Microsoft Office suite of software generally, I would switch back to Google.",3,False,Unreliable,mike2939,
11,2023-04-02 09:57:55,"It's great for storage but I wish I could use MS365 and choose a default of it opening and saving locally, rather than on the OneDrive. I find it hard to find things on the drive whereas if I had that option I could organise and upload them in my own preferred ways. Using Word for donkey's years I have a well developed system of deliberately saving multiple copies of long documents so that I can go back to a previous version if I need to. So I hate working on a ""live"" document which is then hidden in some obscure corner of the OneDrive. That said, it has saved some photos and video clips which J thought were lost forever, so I'm mightily thankful for that!",5,False,Hard to find things!,DaisyWaise,
12,2019-04-27 09:08:19,"Works well and it’s very good to have native mac and iOS clients that seem to function as well as their Windows equivalents, however, OneDrive does not remember where you are or were. 
If you use the app or go to it from a share sheet you always have to to start again from the root and go through folder structures - every time. 
This can be tiresome. I work in an organisation and have to regularly change my password, often, OneDrive can’t remember the new password. 
For a couple of weeks I find myself being directed back to the organisation sign in page and then, having to go back from the root folder to upload, copy, edit, save a file etc. 
If MS could solve that and linked sign ins with Word, excel etc that can leave you in a loop of uneditable docs and multiple sign ins, then it would be a beater.
I use OneDrive because I can’t use a native client for anything else on my organisation PC. The fact that it works so well with my Mac at work and at home, my iPad and iPhone is an unexpected benefit and bonus. 
If they could add some ‘remember where I was’ feature I would be completely happy.",5,False,Very useful but..,Geezering,
13,2020-11-19 14:01:22,"I have noticed after looking back on photo uploads using the automated upload facility, that many picture are being missed completely. This means I have no choice but to double check every single photo I take on my IPhone is uploaded correctly onto one drive, which is very time consuming. Google Photos simply does not have any issues when it comes to backing up my photos it simply works. One drive also does not put them in time stamp order when uploading to one drive which is another issue I have. Overall not impressed with One Drive and will move away to another storage provider if problems are not fixed soon.",4,False,Errors with upload facility - Missed Photos,M Highland,
14,2017-11-20 23:34:35,"The idea behind OneDrive is great - access your files anywhere, on any device. On the iPad, though, things only work smoothly if you have a constant internet connection everywhere you go, which isn’t a realistic scenario for me.

In theory, you can select files and folders for offline use, but in practice this is very erratic. You can select files and folders and the little green icon appears next to them, so all looks good, but when you try to use the file without an internet connection, it’s pot-luck whether it works or not. Sometimes with large folders, setting them for use off line fails completely, with no error message - the green icon appears, but the next time you look, it’s gone again.

Do NOT rely on this feature, and don’t make the mistake I did and buy an iPad Pro as a Mac replacement on the strength of it.",2,False,Working offline is hopeless...,The_lighting_doctor,
15,2020-11-29 14:48:10,"On the MacBook Air it is superb. Finally a Cloud storage solution that doesn’t require a mirror image to be stored on your hard drive. Very easy to use, it’s just a master folder with all your stuff stored and organised as you want them. Easy to make files stored in the Cloud only, to save space on your device, or to store them on your device so that they open more quickly. 
On the iPhone, it is also easy to open files as Read Only, but I can’t see for instance how to delete unwanted Screenshots on the iPhone, hence only 4 stars instead of 5. Again, on the MacBook, it’s as easy as pie. 
It works very well on Windows laptops as well - as you would expect, it being a Microsoft product. 
Very happy overall.",4,False,Very good app,stupidaskingforanickname,
16,2018-09-04 10:10:00,"I only use OneDrive because its included in my Office 365 bundle and I didn’t want to pay twice to have Dropbox. OneDrive is THE most unreliable cloud storage I've ever used. Im constantly having to re-sign in. It’s constantly losing track of my recent documents. When i upload a file from desktop or web browser it sometimes takes days before it shows up in my iOS app and vice versa. 
OneDrive is 100% incapable of being able to sync files between two computers. If a file gets updated on machine 1, it uploads and downloads on machine 2, but then machine 2 logs it the original unaltered file as being the modified one, so then machine 2 re-uploads the old file and often overwrites the newer version. This issue alone completely borked my iTunes library of twelve years. I hugely regret my decision to switch and would happily re-switch if I had the time, patience or bandwidth to resync everything",1,False,Like Dropbox but much worse,Martin Huntford,
17,2021-01-09 21:37:47,"The app experience compared to the web version is inferior. Even simple things like batch selecting images or changing the order of images is needlessly complicated. Another feature with poor UX is sharing. You can share files/folders by creating a single link, but if you wish to configure the user permissions for a link you have to ignore the intuitively titled Link Settings and Copy Link items and instead select the more ambiguous View Only item which be default is hidden from initial display. All link sharing functionality should have a dedicated settings view and not fudged into the iOS share dialogue.  
Trying to playback video is excruciating - it seems to need to download the entire video behind the scenes before starting, leaving the user staring at a black screen and loading graphic for far too long.",2,False,"It's ok, not terrific",Let down again,
18,2023-05-08 11:49:18,"When backing up pictures this never seems to do it in the background. I have to stare at the upload until it’s finished or else it just stops. When bulk uploading, as I don’t have the time to sit with it as frequently as I need to, it doesn’t seem to recognise pictures in between the last couple of days to the last time I remembered to do this. On this occasion, the last time I did this was October 22 and now May 23 it’s only uploaded yesterday and todays. There is no way to select or make it realise that there’s lots of things in between to upload. Google photos on the other hand, uploads and backs up immediately and showing when it’s been done with a picture on the photo when it’s loading. Very clunky and a lot of work when it’s something that can be done effortlessly by google.",1,False,Not able to force upload,Kezwald1,
19,2020-12-04 23:47:31,"I’ve been using OneDrive to backup my photos and documents, the layout is good and it syncs with my windows PC seamlessly. 

When uploading my gallery from my iOS device it took a very long time, the way it uploads photos is not very efficient because it would try to upload 50 or so pictures (and videos) at the same time, this would fill my phone’s RAM and I would have to restart it. When uploading photos I found it works better to switch off videos backup and let all the photos backup first, then let the videos upload last.

All in all OneDrive is very good cloud storage service but the way it uploads your photo gallery needs optimisation and improvements.",4,False,Photos need work.,An iPhønė usėr.,
20,2018-08-11 08:32:05,"We have 2 iPhones each with around 2000 photos on them.  Both have taken ages not to finish syncing.  Both are about 50% complete after lots of manual curation. If you have a dodgy internet connection it seems to stall.  To get it going again you have to reboot the phone.  We are in different houses with different internet providers.  

Everything else is fabulous.  I love one drive.  I use it both personally and for work, both are brilliant.

I hope the once this initial sync is complete it will cope better with the lower load of photos that you have just taken.",5,False,Photo Syncronisation,Hoffman6132,
21,2019-09-16 05:14:47,"I find one drive indispensable. Syncing between platforms is seem less, only occasionally needing a relaunch to remind it to finish syncing, but it’s saved me so many times having it on my phone and on any browser. 

I have to dock a star for the way the pop up ‘offering’ a one month free trial to the paid premium contract. 

There is no option to opt out, only to dismiss it. Rude at best and I question the legality of any contract that demands money but gives you no option to say “no thanks.”

It loses another star for making that dismissal ‘X” white on a white background and in the corner where it is far harder to get the users finger to register. (Sign me up is a massive green button in the middle so why not have a ‘no option there?’ 

Every time it pops up I have to mess about tapping the screen repeatedly in the corner until the iPhone realises I want the corner. 

Come on Microsoft, that’s the same game spyware designers play!",5,False,Loses a moral star but technically brilliant,Simon Beech,
22,2018-03-20 09:45:34,"The app looks great. And at first it makes you think, cool 😎. But once you realize it doesn’t always understand how to put things in order simply from A to Z correctly. Or trying to delete things from your recycling bin can be buggy. 
Or the fact that you can make files offline, but if you wanna do a whole folder you need to pay, but wait. The screen to pay and go premium doesn’t even work/come up 😑. I’m just gonna go back to Dropbox or use google drive. Unless they sort out these buggy problems in the future. Overall, you store your things fine, but some of the little quality of life things can be really annoying in the long run 🏃🏾",3,False,It looks good but...,Palmereap,
23,2023-05-13 15:00:30,"The app is fantastic but going straight to the point it would be nice if you could fix this:
When sharing a big video (more than 5Gb) the generated link opens but a warning pops up saying it can’t be opened through Onedrive app and must load on a browser, however playing through the browser the video is very choppy due to buffering maybe and almost unplayable. 
works fine in the app when I play it though but folks who opens the shared link doesn’t seem to have it playing through the app! 
Hope you can fix this ASAP please. Will update my rate review as soon as this gets fixed 
 Thank you",3,False,App is awesome but some bugs remains,moscab,
24,2024-05-08 11:10:08,"OneDrive is my new favorite! I’ve had a heck of a time bringing files over from my iPad to Windows PC. I’m a digital artist and do most of my illustration work in Procreate (iPad only). I recently switched from a Mac to a Windows PC and have had difficulty finding a quick and reliable way to bulk transfer files. OneDrive uploads and downloads so quickly, the first time I used it I thought it had crashed. But turns out it had just completed the job with superb efficiency 😂 Highly recommend !",5,False,Perfect for transferring files from iPad to Windows PC,evy-bk,
25,2017-12-31 13:03:16,"OneDrive is a good option for storing files from iPad, iPhone and pc.  This is mainly because it is accessible from all applications used on those devices unlike iCloud.  Furthermore, saving to OneDrive is similar to saving to folders on a pc.  I gave 4/5 stars because OneDrive could benefit from an improvement whereby you can save directly into sub-folders which is not always offered so files sometimes need to be moved from the main folder to the relevant sub-folder after being saved.",5,False,Wish subscribed to OneDrive before mess created on iCloud,Lakatan,
26,2019-05-29 10:30:07,"I have been using OneDrive for many years since its launch. Everything seemed to be working fine until only a few weeks ago I decided to delete three folders. I did not go into the recycle bin to permanently delete those files. Next think I know is an email from OneDrive a few days later saying that many folders were permanently deleted from my account. I checked my account and over 40 folders with pictures were not only removed from OneDrive, but permanently deleted from the recycle bin as well. Customer support just confirmed that and couldn’t help me exactly with what has happened. I think that a decent application should take responsibility for something like this and give me further explanations. Very disappointed!",1,False,All my files deleted and removed from recycle bin,teo78@,
27,2018-11-21 13:04:35,"I’ve used the app for the last year and a half after purchasing an iPad Pro to use for university instead of a laptop. Initially, I was really impressed with Microsoft’s whole suite but over the past few months it has gone right downhill.

My biggest pet peeve at the moment lies with the PDF annotations in this app. I used to love to take my notes by tapping to add a sticky note and typing, and it was handy because the note just popped up and you could still read what was on the slide as well as the note, but a couple of updates ago they changed it so that the sticky note is now full screen and the text is TINY, with no way to change the size of either. This makes being able to quickly read notes with the lecture slides impossible. 

PLEASE CHANGE IT BACK, MICROSOFT!",1,False,Students AVOID,Emmurder,
