,date,review,rating,isEdited,title,userName,developerResponse
507,2022-01-21 16:55:21,"Similar issue on word 3 years ago but was fixed. When opening a pdf and marking up with Apple Pencil, the writing kind of ‘smooths’ itself after you make the stroke which is really annoying. Just leave the ‘ink’ where I put it thank you so it resembles my handwriting…",1,False,PDF Markup is poor,Mrtomgreen,
508,2019-10-09 19:04:06,Takes far too long to upload and hangs,5,False,462A3,462A3,
509,2019-06-03 15:00:29,"Better than buying a usb for Xbox
So simple to and to save vids to my phone with just one button",5,False,Simple and useful,"great, amazing and relaxing",
510,2019-09-12 05:23:28,Background video upload not working .. my phone background app Refresh is on but ..But seems this app not working at all,3,False,Background video upload not working,emonshowhan,
511,2019-05-19 22:19:32,"Great app you can open anytime any where 
Instead of carrying any documents 
You can get on your phone tablet and laptop 
It’s good",5,False,Mahesh Valechha,Mahesh v,
512,2018-03-01 00:18:21,Always need to back up all my documents that I saved on USB and use OneDrive as a back up in case I lose it. A student essential app. 👍🏻,5,False,Student essential,wickedkid27,
513,2018-12-18 13:45:11,Used to let you add attachments on Apple’s mail app without the need to remove your OneDrive passcode since it would verify using FaceID. Now this feature is absent it is really annoying as you have to constantly take off your passcode then add attachments then add back your passcode.,2,False,Features inconsistent,TeeMya,
514,2018-06-14 16:13:41,"Used to work amazingly. Then out of nowhere, it signed me out of my business account and now it won’t let me sign in. I’ve tried uninstalling but the same result. It just says “Please Wait...” after entering email and clicking next. Then the “Please Wait...” alert disappears and nothing happens after.",1,False,Doesn’t let me login anymore,UnmountedWolf,
515,2017-12-04 21:59:02,I was using a diff storage app until I came across OneDrive woohoo the best of the best. Will recommend this to everyone to try this and u will not regret it my people.,5,False,Best of the best,Calingos,
516,2023-03-07 07:48:20,Doesn’t request that I can tap allow access to all photos; what a great app!,5,False,Great app!,EdmundPlayz,
517,2024-04-06 19:37:07,"It integrates with well with outlook. However, too many scanned documents have gone missing. I have therefore stopped using it and gone back to my previous cloud storage which was reliable",1,False,Only use if you don’t scan documents,H2535466,
518,2023-06-23 20:14:49,"In an utterly baffling move, the latest update has removed the delete button! How am I meant to manage storage and version control with no delete option? 

The share function has also been disabled. What?",1,False,Hotel California of storage,Suzy Simpson,
519,2021-06-16 06:45:05,I could not do what I can easily do on desktop. From a link I landed to a directory. You can not browse/navigate through directories and sub directories (I have access to) and share that folder (no place in the mobile UI to do that) instead of sharing the single packages.,1,False,Useless,mrsirfabio,
520,2021-02-07 17:07:59,Not as easy as I thought it would be,5,False,Not what I expected,dontneed a nickname,
521,2020-09-02 15:20:42,"Wow 🙂😃😃😃😃. It feels good and safe to know that all my life photos, videos  and documents are safe and can be accessed from anywhere. 
Well-done 👌👌👌👍🏻👍🏻👍🏻👍🏻",5,False,I’m very impressed,Mrs Oma,
522,2020-09-25 19:45:01,"Yet again, Microsoft can’t get it right. It just doesn’t work. This app has bugs and  can’t upload photos and videos, why not? Dropbox and Google Drive are simple and never had a problem but despite me having a paid account nothing will upload from the app.",1,False,Doesn’t work,Markbkk86,
523,2018-05-17 05:22:59,"Simply fantastic, I can pick up files anywhere. Highly recommend this.",5,False,Amazing,Curiouskatsy,
524,2020-07-14 13:20:45,Multiple reports of bug between onedrive and files app where onedrive won’t display contents if items  are more than 50. Only been happening since latest onedrive update. Onedrive app works okay but not in files app. Troubleshooting steps have revealed it is Onedrive update which has broken.,1,False,Don’t update if using with Files app,stitch356,
525,2020-04-07 17:48:19,won’t let me save a video for some reason but other than that good app please try and fix the fact I can’t download the video tho,4,False,idk,gachiHYPER,
526,2018-04-28 06:27:50,"I’m losing confidence that it is saving the docs I upload from my iPhone and iPad, and it’s slow to update.",5,False,Losing confidence,BlackheadedgullUK,
527,2017-11-14 08:38:18,Great to have and is available on all devices so can be used where ever you are ..good to have,5,False,OneDrive for everything,Benneys123,
528,2018-03-06 00:23:40,It just doesn't upload files from my PC. We have very slow broadband.,4,False,How can I get it to work?,En Primeur,
529,2021-12-07 19:31:08,It is brilliant I don’t know what I would do without it because I use it to store my schoolwork,5,False,Brilliant,ugrtt,
530,2021-03-07 11:26:52,It is easy to understand and navigate around the app,5,False,Easy to understand,Joycept,
531,2021-02-24 18:19:20,"This app is helpful for organising documents. It really helped me find work easily. 
       Can’t find work? Download OneDrive now!",5,False,The best organizer for work,"yui889kl""??!",
532,2019-12-08 18:06:04,Great for storing and retrieving files across numerous devices... and for sharing with others,5,False,Perfect for multiple devices.,Torty 73,
533,2020-09-17 09:28:19,"Hi Microsoft, I appreciate you supporting iOS 14 widgets so soon. I can't help but think recent files would be more useful than a photo gallery. Can this be added as an option?",4,False,iOS 14 Widget,Vai Rostampour,
534,2020-04-07 15:17:40,"The synchronisation doesn't work very well, I guess because the mobile app doesn't know when to refresh its cache.

If a locally cached file is replaced by a different file with the same path on another device, the new file is never synchronised to the mobile app.",1,False,Synchronisation doesn't work,Philipp 101,
535,2019-09-23 07:30:06,"Had OneDrive for I forget how many years. 
Use across a Mac, work windows surface, 2 iPhones and a an iPad.
Whatever I’m working on the files are readily available.
I’ve never needed a subscription, the basics are enough to hold all my documents (if you regularly delete old). 
Easy to share info with family/work.
An essential app.",5,False,Serves me well,WWFC101,
536,2019-10-23 18:58:50,"Whenever i’m reading a pdf it will randomly crash, I believe due to memory issues. Also, sometimes it re-downloads files that were meant to be offline already.",2,False,Crashes when viewing pdfs,heyitsdom,
537,2019-08-19 19:00:14,"Fabulous App copied over all my images, easy to upload, better than Dropbox",5,False,Soo Easy To Use,South London Bird,
538,2018-06-20 18:40:26,This was working fine but since the last update (which was to cure a problem which prevented some people from signing in) I have been unable to sign it. It just keeps looping back to the sign in screen,2,False,Unable to log in,Jeff_N_1,
539,2019-04-07 07:14:19,"Trying to upload photos for the first time, to keep back up, keeps crashing. Oops something has gone wrong, message no other help or assistance given.

All ready thing not worth bothering with, best stick to backing up to local pc and a hard drive.",1,False,Photo upload painfully slow keeps crashing,Bobbyboy44,
540,2017-11-09 09:11:03,It’s brilliant tools that is available anytime and anywhere I need it,5,False,One Drive has made my life easier,"Yomi Dickson, Dagenham, UK",
541,2018-01-14 07:04:09,"It stopped updating my camera roll about 3 updates ago and hasn’t worked properly since. Have to manually select recent photos to update them. Takes ages.
(Using iPhone 6s Plus, iOS 11.2.2).

Please Fix.",2,False,Still not updating my camera roll.,UrbanBlitz80,
542,2021-08-27 00:09:16,"This is so cool, I can forward it to my photos. I love it
Download if u use outlook and want ur photos to be secured in ur gallery.",5,False,Amazing,bandsarenot,
543,2024-05-03 21:05:58,"Sharing doesn't work, and hasn't for years. Unintuitive, clunky interface. Another pointless app to take up space on an iPad.

Nothing like investing in this crappy technology and getting no support when nothing can be accessed.

Useless.",1,False,Broken in many ways,UncleNige,
544,2022-12-27 12:04:02,Stop shoving pop ups in my face about upgrading.. begging for reviews. and the idiotic decision to “shake” to provide feedback… what kind of idiot made that decision? App breaks half the time too and no select to delete all button. Have to do it one by one. Absolute obnoxious joke. Heres your review hope it was worth it.,1,False,get lost..,D3adops121,
545,2020-09-17 09:01:53,OneDrive failed to load on iPad.  Latest version fixed the problem. Thanks for speedy turnaround.,5,True,Thanks for fix,reluctantcomplainer,"{'id': 17919772, 'body': 'Hey there, thanks for reporting this issue to us. We fixed an issue causing crashes on iOS 12 in our latest update, version 11.49.15, available now. Please try it out and let us know if it works for you now. If the issue still occurs, please launch the app, shake the device, and tap ""Report a Problem"". If you update your review with your ticket #, we will be able to investigate quickly.\n', 'modified': '2020-09-16T23:11:07Z'}"
546,2021-03-13 21:42:31,"Please work on making the files app work quickly as this is making me consider my office 365 renewal.

I’ve never had this problem with any of the other apps like Dropbox. 

Why did you make a breaking change in prod then say your working on a new better feature?!",1,False,IOS files app,Mrpandygardner,"{'id': 22382133, 'body': 'Hi there, thank you for sharing this feedback with us. We have re-enabled writes to your OneDrive files from the iOS Files app, beginning with version 12.25.1. Please give this a try on version 12.25.1 or greater and let us know if you encounter any issues.', 'modified': '2021-04-21T20:20:01Z'}"
547,2020-02-20 12:55:53,I think it a great service but it takes a bit of getting used to.,5,False,OneDrive,catbay&,
548,2020-09-11 08:23:38,"The latest update seems to have caused the app to crash (at least on iPhone 6) when trying to launch it. It doesn’t get past the splash screen and then just cuts back to the home screen. Works well normally and is a good app, but crash needs fixing asap.",1,False,Crashes on launch,Zephyrsteve,"{'id': 17919837, 'body': 'Hey there, thanks for reporting this issue to us. We fixed an issue causing crashes on iOS 12 in our latest update, version 11.49.15, available now. Please try it out and let us know if it works for you now. If the issue still occurs, please launch the app, shake the device, and tap ""Report a Problem"". If you update your review with your ticket #, we will be able to investigate quickly.\n', 'modified': '2020-09-16T23:16:37Z'}"
549,2020-04-18 15:18:48,The app is good but I have no idea why when I try downloading a video it keeps crashing... then it won’t allow me to open the app again.,4,False,It’s good but...,OnlyTriangle,
550,2019-08-29 22:40:59,"Although it load the previews pretty quickly, it Should load the whole pic more quickly.",4,False,Viewing pic,kenssa,
551,2019-01-05 09:27:12,"Relive some memories from this day

This is not face book, please do not go down this route , i just do not want these annoying fluffy life reminders, keep it simple and workon reliability",3,False,Please keep simple and not turn to Facebook,Etfd,
552,2018-11-08 09:44:06,"What had happened to this? Changed about 2 weeks ago on my iPad - used to be good now it isn’t fit for purpose - tiny selection of tools to top left of screen - pen tool really clumsy and pixelated eraser barely works and you can’t copy text out of documents 

Very, very poor - why change something that didn’t need fixing

Extremely disappointed 

David Hills",4,False,PDF markup facility in onedrive,Callum Mare,
553,2017-11-24 06:33:53,A bit of a struggle syncing documents between on and offline. Easy with photos though,4,False,On/offline,JStuartG,
554,2023-06-27 17:16:07,"I used to rave about this app. It was so versatile and easy to use. But recent changes are disappointing to say the least. 

 Firstly, I don’t seem to be able to see thumbnails of photographs anymore. In some cases it won’t open the photo. 

 Secondly, they have taken away the ability to rename a file. A bit annoying as Apple doesn’t give a choice of naming the file when saving to OneDrive from an iPad.

Another problem: I can’t create a subfolder inside a main folder anymore! Why?",1,False,Updates Are Rubbish,as332l,
555,2020-04-17 10:13:35,"Latest update doesn’t work as it is taking forever, and a day, to upload files. To say that I am disappointed would be an understatement. Sort this, and quickly.
Also, do you keep asking for a name and then tell me it’s taken to put me off. Bet you don’t do that for 5 star ratings.",1,False,Annoyed,fedupfreddy123,
556,2019-09-18 19:35:38,When ever I upload a video it doesn’t show up and I don’t know how to fix it,5,False,Pls fix this,wilkie meatman,
557,2019-03-18 21:56:25,As compare to Dropbox this upload slow,4,False,Slow,Irkj,
558,2019-05-18 07:50:20,Why oh why do they need to keep updating it. The last one was to change the colour of a folder but had only been updated 3 days ago. It’s 150mb it’s a really annoying. I ditched Word & Excel for same reasons. Looks like this will be going as well.,2,False,Updates,4figgis,
559,2019-01-22 19:32:01,"Windows use everywhere ""Date modified"" by default so you can sort documents easily. The onedrive web interface does too, so I'm baffled that the iOS app developpers decided to use ""Date created"" for the app instead....",2,False,"""Date created"" instead of ""Date modified""",CoumeCoume,
560,2018-05-08 06:19:57,I have to keep on deleting the app in order to download a clip from one drive to my phone :/,5,False,It’s amazing but,OnwardHealer204,
561,2018-08-30 13:23:26,what about being able to add covers and being able to take folders out of ones you move them to? You can move folders into folders but what about the opposite? It’s taking far too long to be able to add covers to folders on iOS.,1,False,Good new updates but,Some random otaku,
562,2017-11-18 01:41:16,"I store my life on Onedrive, great to keep everything in one place. Never had any issues.",5,False,Must have,Yettie14,
563,2017-11-18 15:19:30,Im having a major issue with OneDrive with regards to storage limit. Im paying £8.99 for monthly subscription for 1TB OneDrive space for over a year now and since yesterday my OneDrive account is showing “Over Storage Limit” despite having a valid subscription via Apple. I need this issue resolved as soon as possible.,1,False,Over Storage Limit,"Its me, PC",
564,2023-02-19 09:08:35,"Yes, very good makes me feel very secure that someone is saving things for me and lifting the burden off my shouldersIf you know what I mean, kind regards Mr. Ross.",5,False,Cloud.,stanross527,
565,2021-05-29 12:03:43,"This is a great place for storing all your pictures and documents, you get 5GB of storage.",5,False,Excellent app,Zrnho,
566,2022-07-15 19:35:01,"Latest update won’t launch for some reason. It was working fine until updated, but now crashes on opening. Deleting and reinstalling doesn’t work. Can no longer use.",1,False,Crashes on opening,aspascia,"{'id': 31132336, 'body': ""Hello! Thanks for reporting this issue. We've fixed it in the latest version of the app and if you update to version 13.26 you should be able to use the app. If this problem persists please reach out again! "", 'modified': '2022-07-27T21:06:18Z'}"
567,2022-01-28 13:23:46,"Microsoft please get back to me, after i installed one drive it just hangs cannot sign in or click anywhere. I have to uninstall it. I’ve tried all possible fixes nothing working. I was on iPhone 6s Plus and now I’m on 13 pro max …is there some problem with iOS 15?",1,False,Sid,From ex windows phone user,"{'id': 28745125, 'body': 'Hi there, thanks for reporting this and we apologize for the bad experience. Please uninstall and reinstall the app, then try again. If you are still able to reproduce this issue, please open Apple Settings, go to OneDrive, toggle “Clear Account Settings”, and then try opening the OneDrive app. If that doesn’t fix it, please submit a ticket by going to https://onedrive.live.com/?action=feedback, and include the message “Escalate Immediately as per OneDrive iOS Engineering"" in the problem description. Please update your review with your ticket # to help us investigate more quickly.', 'modified': '2022-03-23T17:36:38Z'}"
568,2018-06-19 16:11:18,I’m positive I used to be able to edit share permissions. Have MS removed this option?,5,False,Why Can’t I Edit Share Permissions,Marcus Gv,
569,2020-01-21 19:11:50,"Downloading files works great, but when uploading files they disappear from the progress window part way through.",3,False,Uploading,digitalfx_,
570,2019-04-14 01:52:53,"I've been using OneDrive consistently for over ten years and the only expectations was that my documents backup but my data/documents because files disappear I have hundreds of folders within folders but they're all empty. 

My persistence was only down to paying for Office 365 Business and not wanting to pay for another product such as DropBox, which is where my files are returning.

Thank goodness I remotely backup to a SanDisk Media Drive which thankfully has never lost on document. 

Not impressed.",1,False,Loses content constantly - Avoid,Andrew Carrington,
571,2019-03-22 15:27:12,My app was working fine until I did today’s update. Now I am experiencing the very problems you are saying this update is there to fix. Can no longer upload photos to One Drive so it’s now unusable for me.,2,False,Uploader no longer works,Edvard Von Klinkerhoffen,
572,2018-09-23 09:57:16,"Constantly crashes on ios10 since last update. Was great when it worked. Looks like Microsoft are up to their old tricks and producing junk, just like Apple do these days. Have had to delete the app and cancel my Microsoft subscription. Thank good Apple have equivalents. Rubbish app, not worth downloading.",1,False,Constantly crashes.,dookable,
573,2021-05-19 17:04:56,Fantastic safe way for your files photos and letters,5,False,Super One Drive,derekthedoctor,
574,2018-06-06 09:39:54,"Scanning multiple documents and collating them into a single pdf, was previously a free feature. Though this feature is now only available through their premium option.",1,False,Scanning feature is only available for premium,Gubhts,
575,2018-01-22 21:12:58,My computers one drive folder and the application do not sync correctly. Cannot access folders of work that has been completed on my pc because it has no updated on the app. It has synced correctly on the pc folder.,2,False,Does not sync,hreecesims,
576,2017-11-02 14:34:23,"Didn't get to try this long, not even sure how well it works, or in my case didn't. Installed on an iPad, tried to open a PDF eBook document and the app constantly crashed. So that was my short lived experience with One Drive. Deleted and installed Google Drive with an app that actually works!!!!",1,False,Does this even work?,Sparviter,
577,2017-10-28 15:29:45,The process to upload and to open photos takes far too long also the app crashes when you wait for photos to open.. not good.,2,False,Slow to open and upload photos,Starbuug,
578,2024-01-29 10:31:35,"Recent app update has rendered the personal vault useless as you can no longer upload anything to it…instead just the error message “
You don't have permission to upload to this location”

Needs fixing asap.",1,False,Personal Vault,Don_Paulos,
579,2021-11-29 13:16:42,"I would love to be writing a review which is as ossified as the others on here, but despite installing and uninstalling the app, restarting my phone and doing it again and again and again, the app keeps crashing. 

Useless.",1,False,Doesn’t open,gexekby021,
580,2020-03-30 18:20:56,So pleased to be able to keep my precious pictures,5,False,Thank you,Sylvia&Joe,
581,2018-09-20 15:40:13,"I can save slot file any open it ,,without issues",5,False,Very helpful,Diva angel 1,
582,2019-04-30 05:15:34,"From a usability point of view changing icons is a really bad thing - we get used to looking for the one we know! Dropbox changed theirs a year or more ago and I still look for the old one 

With Microsoft they are changing all of the office icons again! It’s incredibly frustrating",1,False,Stop changing your icons!,alex3410,
583,2019-04-28 20:49:07,"So I edited a document in excel today. Saved to 1 drive as always. But when I go to onedrive on the Ipad it only shows the version of the Document dated 11 April. Not todays version 28th April. Really annoying, going have to use a different cloud base storage whilst apple and Microsoft play stupid games with the users.",1,False,Only showing old files,Cockatiel man,
584,2019-03-28 05:14:22,Have to re-download this every other day since recently my key work file just keeps vanishing from the shared folder. Delete/download and it reappears but then I have to keep faffing through the tutorial ‘tips’ not to mention chewing into data allowance. Sort this out.,1,False,File keeps disappearing?!?,esenses,
585,2018-03-11 13:37:45,Won't let me save the video it comes up saying something and I can't do it what do I do,5,False,Why,SlugSlashSabre,
586,2018-08-10 12:55:18,"I have been able to use my one drive account perfectly ever since I have had it until now. Now I cannot even access it at all on my iPhone 6. I have deleted and downloaded it a few times to no avail. Please could this issue be resolved.

Thank you",1,False,Not working at all,Body n Minds,
587,2020-11-19 16:41:14,Very pleased with this storage system. It is reassuring to know that   Files and pictures etc are safe and secure.,5,False,MisterMal,Agent Y-10,
588,2018-02-01 02:48:09,"This app is so great but using scan, files are too large to attach in email.",4,False,Scan file too large,PangOnmadee,
589,2023-05-10 19:27:16,OneDrive is ok but it is soooo slow to navigate. Constant prompts to turn on superfluous features and pleas to allow photo upload don’t improve things either.,2,False,Slow to navigate,Mr. O.,
590,2021-06-16 08:42:58,"This app is good, but I can’t fathom why the simple ability to create shortcuts to folders on the landing page or on my iPad home screen isn’t included.",3,False,Great but please include shortcuts…,Dan Dwight,
591,2021-01-15 10:22:36,"When using IPad for photos and Videos, it depends on how you create the video, if you create in Apple you cannot easily watch it through Microsoft, and Photo quality lost and unusable. 
If you use OneDrive to create the Video or photo on IPad it works but this is not convenient.",1,False,Lack of Apple and Microsoft compatibility,ShaneB+,
592,2019-07-28 11:26:55,Everything on my computer on my phone. So handy.,5,False,Fantastic,Mr Mon,
593,2019-10-29 23:56:10,"If you have a shared are on another onedrive, it does not appear as a folder to upload too! Using BookCreator. 

I have to fave to my onedrive then open onedrive and move the file to the shared folder.",3,False,New iOS  no shared folder,AppRevieweroftheYear2017,
594,2017-10-30 22:00:32,This is such a brilliant way of storing away precious files and photos for the Future. Keep up the good work.,5,False,An Amazing storage App,greatest game evs,
595,2017-11-27 19:01:00,Everything else seems to work fine except when I uploaded my png files all the drawing layers has merged.,4,False,Png problem,Olive Ham,
596,2017-10-20 17:50:59,The videos are not playing when you load them,3,False,Videos not playing,Rodney jrg,
597,2021-07-04 21:48:31,I would watch this app - for no apparent reason it starts chewing up and not releasing iPad free capacity until you run out. I’m looking at alternatives now as it intermittently causes issues on a device critical to make work.,2,False,Capacity issues,SiW33,
598,2023-10-23 15:28:02,Often we can’t open or share things we both work on. It seems to default to extreme security which we don’t know goes to over-ride. Very frustrating and time consuming.,1,False,Poor for sharing,Suzeworld00,
599,2021-10-26 19:10:24,Every time I close the OneDrive app I get a notification telling me I closed the app to soon and have stopped the camera upload but there is nothing still uploading all uploads have been completed really annoying,1,False,Notifications,vgfdryijbxd,
600,2021-04-08 13:28:11,Enough space to organise and keep important files on the cloud.,5,False,Good cloud storage space,Linc D,
601,2020-08-05 08:05:36,I have no problems transferring files between devices.,5,False,Good,Nock Murales,
602,2020-11-25 07:29:13,Camera uploads have never been the most reliable thing about this app. But recently they are constantly stalking. Really bad. Tired of ‘resetting the cache’ and ‘resetting the phone’. Please just fix it!,2,False,Camera uploads getting worse.,Dr Stuart,
603,2018-07-04 15:06:06,"I use it to transfer my mucus between artist I record for, quick easy and very convenient",5,False,Great for free,Doeavelli,
604,2019-09-16 17:17:47,When I try to upload a video onto my account it takes forever and always says waiting... I hope OneDrive will be able to fix this so that I can upload on the go to go to my computer,1,False,Uploading photos and videos taking forever,JJKILL3R,
